{
  "schema_version": "h01-result-v1",
  "result_id": "RESULT-H01-VALIDATE",
  "trace_id": "TRACE-H01-COMPLETE",
  "status": "SUCCEEDED",
  "summary": "H01 契约校验全部通过",
  "completion_evidence_refs": [
    "V-H01-CONTRACT-CHECK"
  ],
  "created_by": "executor",
  "scope": "harness-engineering",
  "source_refs": [
    "A-HARNESS-ENGINEERING-PRINCIPLES"
  ]
}
